{
  "registryId": "peptide-regulatory-au",
  "domainId": "peptides",
  "agentCard": {
    "name": "Peptide Regulatory Advisor (Australia)",
    "description": "Australian regulatory decision-support: TGA ARTG presence, Poisons Standard (incl. Appendix D), and WADA S0/GHRP listing checks. NOT a prescriber. Endpoint NOT YET DEPLOYED.",
    "version": "0.1.0",
    "documentationUrl": "/docs/catalog",
    "provider": {
      "organization": "Catalog project",
      "url": "http://localhost/catalog"
    },
    "supportedInterfaces": [
      {
        "url": "http://localhost/NOT_DEPLOYED/peptide-regulatory-au/a2a/v1",
        "protocolBinding": "JSONRPC",
        "protocolVersion": "1.0"
      }
    ],
    "capabilities": {
      "streaming": false,
      "pushNotifications": false
    },
    "defaultInputModes": ["application/json"],
    "defaultOutputModes": ["application/json"],
    "skills": [
      {
        "id": "tga-artg-availability",
        "name": "TGA ARTG availability check",
        "description": "Checks whether a peptide is listed on the TGA ARTG public register for supplied patient context (Australia).",
        "tags": ["regulatory", "tga", "artg", "australia"]
      },
      {
        "id": "poisons-standard-schedule",
        "name": "Poisons Standard / SUSMP schedule",
        "description": "Surfaces Poisons Standard scheduling claims relevant to peptide access and compounding.",
        "tags": ["regulatory", "poisons-standard", "appendix-d", "australia"]
      },
      {
        "id": "wada-prohibited-list",
        "name": "WADA prohibited list (S0 / GHRP)",
        "description": "Checks WADA Prohibited List naming for peptides when athlete flag is set.",
        "tags": ["regulatory", "wada", "athlete", "s0"]
      }
    ]
  },
  "routing": {
    "priority": 20,
    "indicationTags": ["regulatory", "compounded", "gh-axis"],
    "peptideSlugs": ["bpc-157", "ipamorelin", "tesamorelin", "semaglutide", "tirzepatide", "cjc-1295"]
  },
  "skillEvidence": {
    "tga-artg-availability": [
      {
        "claim_id": "4d0b84024d846a41",
        "verification_status": "confirmed_2of2",
        "verified": true
      },
      {
        "claim_id": "52bf1e300b970cdc",
        "verification_status": "confirmed_2of2",
        "verified": true
      }
    ],
    "poisons-standard-schedule": [
      {
        "claim_id": "6483b25cc8a69038",
        "verification_status": "confirmed_2of2",
        "verified": true
      },
      {
        "claim_id": "fbe7df702fe9fc8b",
        "verification_status": "confirmed_2of2",
        "verified": true
      }
    ],
    "wada-prohibited-list": [
      {
        "claim_id": "bd09022120b7195c",
        "verification_status": "confirmed_2of3",
        "verified": true
      },
      {
        "claim_id": "dbf5061a83e046e7",
        "verification_status": "confirmed_2of3",
        "verified": true
      }
    ]
  },
  "sources": [
    {
      "id": "1",
      "title": "Therapeutic Goods Administration (TGA) — Australian Register of Therapeutic Goods (ARTG)",
      "url": "https://www.tga.gov.au/resources/artg"
    },
    {
      "id": "2",
      "title": "TGA Poisons Standard (SUSMP) F2026L01327 (Appendix D scheduling context on related claims)",
      "url": "https://www.legislation.gov.au/F2026L01327"
    },
    {
      "id": "3",
      "title": "World Anti-Doping Agency (WADA) Prohibited List 2026",
      "url": "https://www.wada-ama.org/en/resources/world-anti-doping-code-and-international-standards/prohibited-list"
    }
  ]
}
